{
  "$schema": "https://json-schema.org/draft/2020-12/schema",
  "$id": "https://inference-atlas.dev/schemas/model.schema.json",
  "title": "Model record",
  "description": "One model family member, unquantized. The id is the Hugging Face repo id verbatim, so the record lives two levels deep. Quantizations are child records under models/<owner>/<name>/quants/. File: models/<owner>/<name>/model.json",
  "type": "object",
  "additionalProperties": false,
  "required": ["schema_version", "id", "name", "hf_id", "vendor", "params_b", "context_length"],
  "properties": {
    "schema_version": { "type": "integer", "const": 1 },
    "id": {
      "$ref": "https://inference-atlas.dev/schemas/common.schema.json#/$defs/model_id",
      "description": "The Hugging Face repo id, verbatim and case-preserved: Qwen/Qwen3.8-27B, google/gemma-4-E2B-it. Equals the directory path under models/.",
      "$comment": "id and hf_id must be the same string. JSON Schema cannot compare two properties, so the validators (packages/core/scripts/check-registries.mjs, tools/validate, bench) enforce that."
    },
    "name": { "type": "string", "minLength": 1 },
    "hf_id": {
      "$ref": "https://inference-atlas.dev/schemas/common.schema.json#/$defs/model_id",
      "description": "Hugging Face repo of the reference (usually BF16) weights. Must equal id — the id is this repo. The weights of a quantization live elsewhere; see quant.hf_id.",
      "$comment": "No longer nullable: under this scheme a model that is not on the Hub has no id, and that would be a spec change rather than a null."
    },
    "family": {
      "$ref": "https://inference-atlas.dev/schemas/common.schema.json#/$defs/nullable_string"
    },
    "vendor": { "type": "string", "minLength": 1 },
    "params_b": {
      "type": "number",
      "minimum": 0,
      "description": "Total parameters in billions."
    },
    "active_params_b": {
      "type": ["number", "null"],
      "minimum": 0,
      "description": "Active parameters per token in billions. Equals params_b for dense models; drives the bandwidth plausibility bound for MoE."
    },
    "architecture": {
      "$ref": "https://inference-atlas.dev/schemas/common.schema.json#/$defs/nullable_string",
      "description": "The transformers architecture class, e.g. \"Qwen3MoeForCausalLM\"."
    },
    "moe": { "type": "boolean", "default": false },
    "experts": {
      "$ref": "https://inference-atlas.dev/schemas/common.schema.json#/$defs/nullable_integer"
    },
    "experts_active": {
      "$ref": "https://inference-atlas.dev/schemas/common.schema.json#/$defs/nullable_integer"
    },
    "attention": {
      "type": ["string", "null"],
      "enum": ["mha", "gqa", "mla", "hybrid", "mamba", "linear", null],
      "description": "\"hybrid\" = interleaved full/linear or SSM layers; matters for prefix caching support."
    },
    "modalities": {
      "type": "array",
      "minItems": 1,
      "uniqueItems": true,
      "items": { "type": "string", "enum": ["text", "image", "audio", "video"] }
    },
    "context_length": { "type": "integer", "minimum": 1 },
    "licence": { "type": "string", "minLength": 1 },
    "released": {
      "oneOf": [
        { "$ref": "https://inference-atlas.dev/schemas/common.schema.json#/$defs/iso_date" },
        { "type": "null" }
      ]
    },
    "tags": { "type": "array", "uniqueItems": true, "items": { "type": "string" } },
    "links": { "$ref": "https://inference-atlas.dev/schemas/common.schema.json#/$defs/links" },
    "notes": {
      "$ref": "https://inference-atlas.dev/schemas/common.schema.json#/$defs/nullable_string"
    }
  }
}
