{
  "schema_version": 1,
  "id": "openai/gpt-oss-20b",
  "name": "GPT-OSS 20B",
  "hf_id": "openai/gpt-oss-20b",
  "family": "gpt-oss",
  "vendor": "openai",
  "params_b": 20.9,
  "active_params_b": 3.6,
  "architecture": "GptOssForCausalLM",
  "moe": true,
  "experts": 32,
  "experts_active": 4,
  "attention": "gqa",
  "modalities": [
    "text"
  ],
  "context_length": 131072,
  "licence": "Apache-2.0",
  "released": "2025-08-05",
  "tags": [
    "chat",
    "reasoning",
    "moe",
    "small"
  ],
  "notes": "Fits 16 GB. The best candidate for a broad low-end hardware sweep."
}
