{
  "schema_version": 1,
  "id": "llama-3.3-70b",
  "name": "Llama 3.3 70B Instruct",
  "hf_id": "meta-llama/Llama-3.3-70B-Instruct",
  "family": "llama-3.3",
  "vendor": "meta",
  "params_b": 70.6,
  "active_params_b": 70.6,
  "architecture": "LlamaForCausalLM",
  "moe": false,
  "attention": "gqa",
  "modalities": [
    "text"
  ],
  "context_length": 131072,
  "licence": "llama3.3",
  "released": "2024-12-06",
  "tags": [
    "chat",
    "large",
    "baseline"
  ],
  "notes": "The standard dense 70B. On a single 24 GB card it only exists at 4 bit with offloading, which makes it a useful stress case for the plausibility checks."
}
