{
  "schema_version": 1,
  "id": "meta-llama/Llama-3.1-8B-Instruct",
  "name": "Llama 3.1 8B Instruct",
  "hf_id": "meta-llama/Llama-3.1-8B-Instruct",
  "family": "llama-3.1",
  "vendor": "meta",
  "params_b": 8.03,
  "active_params_b": 8.03,
  "architecture": "LlamaForCausalLM",
  "moe": false,
  "attention": "gqa",
  "modalities": [
    "text"
  ],
  "context_length": 131072,
  "licence": "llama3.1",
  "released": "2024-07-23",
  "tags": [
    "chat",
    "small",
    "baseline"
  ],
  "notes": "The most measured model in the world, which makes it the best sanity check: if a new hardware entry produces a strange Llama 3.1 8B number, the entry is wrong, not the model."
}
