{
  "schema_version": 1,
  "id": "cognitivecomputations/Dolphin3.0-Mistral-24B",
  "name": "Dolphin 3.0 Mistral 24B",
  "hf_id": "cognitivecomputations/Dolphin3.0-Mistral-24B",
  "family": "mistral",
  "vendor": "cognitivecomputations",
  "params_b": 24.2,
  "active_params_b": 24.2,
  "architecture": "MistralForCausalLM",
  "moe": false,
  "attention": "gqa",
  "modalities": [
    "text"
  ],
  "context_length": 131072,
  "licence": "apache-2.0",
  "released": "2026-01-15",
  "tags": [
    "chat",
    "uncensored",
    "tools"
  ],
  "notes": "Refusal-free finetuning by cognitivecomputations. Based on Mistral Small 24B Base 2501."
}