{
  "schema_version": 1,
  "id": "Qwen/Qwen3.6-35B-A3B",
  "name": "Qwen3.6-35B-A3B",
  "hf_id": "Qwen/Qwen3.6-35B-A3B",
  "family": "qwen3.6",
  "vendor": "alibaba",
  "params_b": 35.952,
  "active_params_b": 3.0,
  "architecture": "qwen3_5_moe",
  "moe": true,
  "experts": 256,
  "experts_active": 8,
  "attention": "gqa",
  "modalities": [
    "text",
    "image"
  ],
  "context_length": 262144,
  "licence": "Apache-2.0",
  "tags": [
    "chat",
    "reasoning",
    "moe",
    "vision"
  ],
  "links": {
    "hf": "https://huggingface.co/Qwen/Qwen3.6-35B-A3B"
  },
  "notes": "Qwen3_5MoeForConditionalGeneration, read out of the base model's config.json: 40 layers, hidden 2048, 256 routed experts with top-8, vocab 248,320, native context 262,144. params_b and active_params_b are the vendor's own naming (35B total, A3B active) rather than a tensor count taken from a checkpoint; the served quant here is a community NVFP4 conversion, so a figure derived from its shards would describe the quantization rather than the model."
}
