{
  "schema_version": 1,
  "id": "inclusionAI/Ling-3.0-flash",
  "name": "Ling-3.0-flash",
  "hf_id": "inclusionAI/Ling-3.0-flash",
  "family": "ling-3.0",
  "vendor": "inclusionai",
  "params_b": 124,
  "active_params_b": 5.1,
  "architecture": "BailingMoeV3ForCausalLM",
  "moe": true,
  "experts": 512,
  "experts_active": 8,
  "attention": "hybrid",
  "modalities": [
    "text"
  ],
  "context_length": 262144,
  "licence": "MIT",
  "released": "2026-07-10",
  "tags": [
    "chat",
    "long-context"
  ],
  "notes": "Counts and context read from the released config.json and model card: 124B total / 5.1B active, 42 layers as 35 Kimi Delta Attention (linear) + 7 gated MLA (5:1), 512 routed experts + 1 shared, 8 active, vocab 157184, max_position_embeddings 262144 with rope_scaling null (native 256K; the community GGUF's 131072 metadata is a conversion artefact). Earlier values in this record (128B / 12B active / 256 experts / 131072) were estimates from a Q5_K_M footprint and are superseded."
}
